<?xml version="1.0" encoding="UTF-8"?>
<xs:schema xmlns="http://javaops.ru"
           xmlns:xs="http://www.w3.org/2001/XMLSchema"
           targetNamespace="http://javaops.ru"
           elementFormDefault="qualified" attributeFormDefault="unqualified">

    <xs:element name="Payload">
        <xs:complexType>
            <xs:all>
                <xs:element name="Cities">
                    <xs:complexType>
                        <xs:sequence minOccurs="1" maxOccurs="unbounded">
                            <xs:element ref="City"/>
                        </xs:sequence>
                    </xs:complexType>
                </xs:element>
                <xs:element name="Users">
                    <xs:complexType>
                        <xs:sequence minOccurs="0" maxOccurs="unbounded">
                            <xs:element ref="User"/>
                        </xs:sequence>
                    </xs:complexType>
                </xs:element>
                <xs:element name="Projects">
                    <xs:complexType>
                        <xs:sequence minOccurs="0" maxOccurs="unbounded">
                            <xs:element ref="Project"/>
                        </xs:sequence>
                    </xs:complexType>
                </xs:element>
                <xs:element name="Participants">
                    <xs:complexType>
                        <xs:sequence minOccurs="0" maxOccurs="unbounded">
                            <xs:element ref="Participant"/>
                        </xs:sequence>
                    </xs:complexType>
                </xs:element>
            </xs:all>
        </xs:complexType>
    </xs:element>

    <xs:element name="User">
        <xs:complexType>
            <xs:sequence>
                <xs:element type="xs:string" name="email"/>
                <xs:element type="xs:string" name="fullName"/>
            </xs:sequence>
            <xs:attribute type="flagType" name="flag" use="required"/>
            <xs:attribute type="xs:IDREF" name="city" use="required"/>
        </xs:complexType>
    </xs:element>

    <xs:simpleType name="flagType">
        <xs:restriction base="xs:string">
            <xs:enumeration value="active"/>
            <xs:enumeration value="deleted"/>
            <xs:enumeration value="superuser"/>
        </xs:restriction>
    </xs:simpleType>

    <xs:element name="City" type="cityType"/>

    <xs:complexType name="cityType">
        <xs:simpleContent>
            <xs:extension base="xs:string">
                <xs:attribute type="xs:ID" name="id" use="required"/>
            </xs:extension>
        </xs:simpleContent>
    </xs:complexType>

    <xs:element name="Project">
        <xs:complexType>
            <xs:sequence minOccurs="0" maxOccurs="unbounded">
                <xs:element ref="Group"/>
            </xs:sequence>
            <!--<xs:complexContent>
                <xs:extension base="xs:string">
                    <xs:attribute name="name" use="required">
                        <xs:simpleType>
                            <xs:restriction base="xs:string">
                                <xs:minLength value="4"/>
                                <xs:maxLength value="20"/>
                            </xs:restriction>
                        </xs:simpleType>
                    </xs:attribute>
                    <xs:attribute name="description" use="optional">
                        <xs:simpleType>
                            <xs:restriction base="xs:string">
                                <xs:minLength value="4"/>
                                <xs:maxLength value="200"/>
                            </xs:restriction>
                        </xs:simpleType>
                    </xs:attribute>
                </xs:extension>
            </xs:complexContent>-->
            <xs:attribute name="name" use="required">
                <xs:simpleType>
                    <xs:restriction base="xs:string">
                        <xs:minLength value="4"/>
                        <xs:maxLength value="20"/>
                    </xs:restriction>
                </xs:simpleType>
            </xs:attribute>
            <xs:attribute name="description" use="optional">
                <xs:simpleType>
                    <xs:restriction base="xs:string">
                        <xs:minLength value="4"/>
                        <xs:maxLength value="200"/>
                    </xs:restriction>
                </xs:simpleType>
            </xs:attribute>
        </xs:complexType>
    </xs:element>
    
    <xs:element name="Group">
        <xs:complexType>
            <xs:sequence minOccurs="1" maxOccurs="200">
                <xs:element ref="Group_member"/>
            </xs:sequence>
            <xs:attribute type="xs:string" name="name" use="required"/>
            <xs:attribute type="groupType" name="type" use="required"/>
        </xs:complexType>
    </xs:element>
    
    <xs:simpleType name="groupType">
        <xs:restriction base="xs:string">
            <xs:enumeration value="REGISTERING"/>
            <xs:enumeration value="CURRENT"/>
            <xs:enumeration value="FINISHED"/>
        </xs:restriction>
    </xs:simpleType>
    
    <xs:element name="Participant">
        <xs:complexType>
            <xs:attribute type="xs:ID" name="id" use="required"/>
            <xs:attribute type="xs:string" name="firstName" use="required"/>
            <xs:attribute type="xs:string" name="lastName" use="required"/>
        </xs:complexType>
    </xs:element>

    <xs:element name="Group_member">
        <xs:complexType>
            <xs:attribute type="xs:IDREF" name="id_participant" use="required"/>
        </xs:complexType>
    </xs:element>

</xs:schema>