<Payload xmlns="http://javaops.ru"
         xmlns:xsi="http://www.w3.org/2001/XMLSchema-instance"
         xsi:schemaLocation="http://javaops.ru payload.xsd">
    <Users>
        <User flag="active" city="kiv">
            <email>gmail@gmail.com</email>
            <fullName>Full Name</fullName>
        </User>
        <User flag="superuser" city="spb">
            <email>admin@javaops.ru</email>
            <fullName>Admin</fullName>
        </User>
        <User flag="deleted" city="spb">
            <email>mail@yandex.ru</email>
            <fullName>Deleted</fullName>
        </User>
    </Users>
    <Cities>
        <City id="spb">Санкт-Петербург</City>
        <City id="kiv">Киев</City>
        <City id="mnsk">Минск</City>
    </Cities>
    <Projects>
        <Project name="topjava" description="cool project">
            <Group name="topjava06" type="FINISHED">
                <Group_member id_participant="dvarygin"/>
                <Group_member id_participant="iivanov"/>
            </Group>
            <Group name="topjava08" type="CURRENT">
                <Group_member id_participant="ssemenov"/>
            </Group>
        </Project>
        <Project name="masterjava" description="cool project too"/>
    </Projects>
    <Participants>
        <Participant id="dvarygin" firstName="Dmitriy" lastName="Varygin"/>
        <Participant id="iivanov" firstName="Ivan" lastName="Ivanov"/>
        <Participant id="ssemenov" firstName="Semen" lastName="Semenov"/>
    </Participants>
</Payload>